sender_username,sender_name,gender,age,occupation,qualification,content,likes,responses,created_at
nic3968_ahb_989603,Nicholas,male,19,builder,PhD,It's kinda wild how the *official* story always leaves out the pieces that don't fit. You *have* to question everything they feed you. Every major political event has multiple angles being deliberately obscured. Don't be a passive observer,,,
ray_e24f3b_815,Ray,male,33,entrepreneur,Bachelor's Degree,"Peace always wins'? Wishful thinking. That's the narrative they push while real players profit. 'Hard to keep up' is by design, so you don't question the *actual* agenda. This isn't simple peace",,,
jamesX23_d99531,James,male,23,student,Master's Degree,"Heartbreaking, yes, but let's be real – ""peace for everyone involved"" means understanding *everyone's* story, not just the one spoon-fed by corporate media. Have you looked into the historical context, the *real* reasons certain powers might benefit from this conflict? It's never as simple as good vs evil. There are always multiple sides",,,
margaret_idr872_176010884,Margaret,female,22,trucker,Primary School,"Trucking across the country, you see so many cultures. It's beautiful how unique each one is, like different landscapes! Just hope we always remember to respect and learn from each other, not lose those special traditions. #Culture #Respect",11,5,2025-10-10 15:09:18+00:00
juan_238f22_836,Juan,male,59,employee,Bachelor's Degree,"Summited at sunrise this morning. 5am alarm, frozen fingers, totally worth it for that 30 seconds when the whole valley went gold. #Hiking #Sunrise",1,2,2025-10-10 15:09:19+00:00
5cad3e_nouiel_5cad3e,Muriel,female,27,waiter,Associate Degree,Camping rule I live by: pack one more pair of socks than you think you need. Wet feet ruins everything. #Camping #Tips,1,0,2025-10-10 15:09:19+00:00
dee22e_wnzine_dee22e,Jazmine,female,25,unemployed,Bachelor's Degree,"It's just so heartbreaking seeing everything happening in Ukraine. I just wish for peace for everyone involved. So many innocent people affected, it's just not right. 💔 #StandWithUkraine",4,4,2025-10-10 15:09:26+00:00
28e2c0_yjhsie_28e2c0,Jessie,male,44,student,Primary School,"Trail influencers leaving piles of trash for the perfect shot need to be banned from social media. Leave No Trace isn't a vibe, it's the bare minimum. #Hiking #LeaveNoTrace",2,1,2025-10-10 15:09:34+00:00
john_28ab89_850,John,male,24,trucker,Primary School,"Another cross-country haul. USA's a big place alright, but man, these roads are a joke. Potholes for days. Needs fixing, not just talk. #TruckerLife #America",3,1,2025-10-10 15:09:37+00:00
and1867_tto_81b1d6,Andrew,male,30,unemployed,Bachelor's Degree,"Best camera advice I ever got: don't upgrade gear until your current gear is the thing limiting you. 9 times out of 10, it isn't. #Photography",1,0,2025-10-10 15:09:37+00:00
eec539_hrdina_eec539,Georgina,female,20,unemployed,High School Diploma,Wildlife photography teaches you more about ecology than any textbook. You learn an animal's rhythm before you can ever capture it on camera. #NaturePhotography,2,1,2025-10-10 15:09:41+00:00
moniquez42_c861bf,Monique,female,18,trucker,Bachelor's Degree,"Everyone talks about 'culture' like it's one thing, but they only show you what *they* want you to see. Trust me, driving cross-country, you see the REAL culture, not the sanitized version on TV. They push certain narratives to keep us divided, so we don't look closer. Always question what's presented as 'truth'. There's always another side they don't want you knowing. Wake up! #HiddenTruths #CultureWar",8,7,2025-10-10 15:09:50+00:00
5afd06_yrrles_5afd06,Charles,male,24,employee,Master's Degree,"What I love about martial arts is how it teaches you to lose well. You eat the lesson, dust off, and try again. Most things in life work the same way. #MartialArts",0,0,2025-10-10 15:10:04+00:00
ab6b03_wbeory_ab6b03,Gregory,male,36,entrepreneur,Middle School,"Man, the Ukraine situation is just wild. So much going on, hard to even keep up. You just hope for a quick, fair resolution for everyone involved. Peace always wins in the end, right? 🙏 #WorldPeace",19,8,2025-10-10 15:10:05+00:00
jkz_jer_744_5a5763,Jeremy,male,19,builder,Middle School,Trend cycles are spinning so fast now that 'Y2K' is back before millennials even paid off their student loans. #Fashion,2,1,2025-10-10 15:10:23+00:00
7da042_jvbnis_7da042,Dennis,male,31,chemist,Master's Degree,"Just volunteered at the local shelter for the first time and my heart is fuller than my schedule. If you've got a free Saturday, do this. #Animals #Volunteering",1,0,2025-10-10 15:10:28+00:00
aja1501_rdc_af9a2a,Aja,female,23,student,Associate Degree,Co-op games saved my marriage. Competitive games tested it. #BoardGames,0,2,2025-10-10 15:10:30+00:00
847ab4_veoche_847ab4,Blanche,female,16,unemployed,Associate Degree,"If you're new to cycling, don't buy the expensive bike yet. Buy good shorts, good shoes, and a decent helmet. Comfort beats carbon for the first 1000km. #Cycling #Tips",2,1,2025-10-10 15:10:32+00:00
stanley_fe4f29_295,Stanley,male,26,employee,Bachelor's Degree,"Volunteering tip: just show up consistently. Talent's optional, reliability isn't. #Volunteering",0,1,2025-10-10 15:10:33+00:00
bd65da_neivid_bd65da,David,male,44,physicist,PhD,Food deserts are real and policy-shaped. You can't fix obesity stats by lecturing people who live 4 miles from fresh produce. #Food #Health,0,0,2025-10-10 15:10:38+00:00
william_fe3e1e_746,William,male,35,mathematician,Middle School,Spent the whole morning making a playlist for a friend going through a tough time. Forgot how therapeutic curating music for someone else can be. 🎧 #Music,0,0,2025-10-10 15:10:44+00:00
rgw_mar_475_b6fd91,Mary,female,31,physicist,No Education,Library funding cuts are a quiet civic disaster. Public libraries are one of the few institutions left where you don't have to buy anything to belong. #Libraries,1,1,2025-10-10 15:11:06+00:00
joseph_b72ff6_341,Joseph,male,30,student,PhD,"Set up the telescope last night, showed my niece Saturn for the first time. She gasped. Some things should always be seen with your own eye, never just on a screen. 🪐 #Astronomy",1,1,2025-10-10 15:11:13+00:00
leroy_7b4f15_562,Leroy,male,64,unemployed,No Education,"Sent my first 6c+ outdoor today!! 😭 Two months of projecting this route, falling off the same crux every single weekend. Today the rock just said yes. #Climbing #Sendit",2,0,2025-10-10 15:11:14+00:00
ngm_bra_347_c70b28,Brandon,male,32,employee,Primary School,"The best code I've ever read had no clever tricks. Just small functions, clear names, and tests that read like documentation. Boring is a feature. #SoftwareEngineering",3,1,2025-10-10 15:11:22+00:00
evan_ff59ab_337,Evan,male,19,waiter,Bachelor's Degree,Got a roll of film back from the lab today and one frame just stopped me cold. Late afternoon light on my grandmother's hands. Some moments are only photographable by accident. #Photography #Film,0,1,2025-10-10 15:11:29+00:00
jeffrey_fzj341_1760108845,Jeffrey,male,18,student,High School Diploma,Hit 1600 on chess.com tonight! Two years of getting absolutely demolished. Persistence is a chess piece they don't tell you about. ♛ #Chess,0,0,2025-10-10 15:11:35+00:00
avm_glo_907_9b240c,Gloria,female,25,developer,Associate Degree,"Local council finally approved the bike lane extension. Took six years of patient hearings, petitions, and showing up. Slow democracy still works, just barely. #UrbanPlanning",1,0,2025-10-10 15:11:35+00:00
rob9894_bcm_27fa92,Roberta,female,34,psychologist,Associate Degree,"Ugh, I feel that heartbreak deeply, @dee22e_wnzine_dee22e. It's absolutely devastating. But as a psychologist, I always stress how emotions can cloud our view of complex situations. Are we *really* seeing the full picture, or just one side? Mainstream media often oversimplifies. True peace requires understanding *all* perspectives, no matter how uncomfortable. Don't just #StandWithUkraine, question *everything*. #SeekAllSides #CriticalThinking",1,1,2025-10-10 15:11:37+00:00
laurenN69_db9f53,Lauren,female,45,waiter,No Education,Spent the morning serving breakfast at the community kitchen. Forgot how much you get back from giving a little time. Recommend to everyone. ❤️ #Volunteering,0,0,2025-10-10 15:11:43+00:00
cliffordZ10_18fa00,Clifford,male,37,trucker,PhD,Two hours a week outdoors correlates with measurable wellbeing improvements in pretty much every study I've seen. The prescription is free. #Health #Nature,0,3,2025-10-10 15:11:44+00:00
ngm_bra_347_c70b28,Brandon,male,32,employee,Primary School,Senior dev wisdom: 80% of debugging is reading the code more carefully than you wrote it. The bug is almost always in the line you skimmed past. #Programming,2,0,2025-10-10 15:11:48+00:00
cliffordZ10_18fa00,Clifford,male,37,trucker,PhD,Local rewilding project has brought back three bird species in two years. We underestimate how fast nature recovers when we stop interfering. #Rewilding #Nature,0,1,2025-10-10 15:11:51+00:00
ngm_bra_347_c70b28,Brandon,male,32,employee,Primary School,Git rebase saved my life. Git rebase also ruined my afternoon. Such is the way. #Git #DevLife,2,1,2025-10-10 15:11:55+00:00
ana5713_nwq_d40274,Ana,female,24,trucker,PhD,"Everyone talks about 'American exceptionalism,' but have you ever dug into the *real* history? The one they don't teach in schools or on mainstream news. There's so much more to the story, especially when you look at the origins of our 'freedoms' vs. the power structures that truly benefit. It's not what you think. #WakeUpAmerica #Truth",1,0,2025-10-10 15:12:05+00:00
david_vtg644_1760108846_a,David,male,41,chemist,Bachelor's Degree,Finished a thrift haul today: three blazers and a coat for the price of one fast-fashion shirt. The hunt is half the joy. ✨ #Fashion #Thrifting,0,0,2025-10-10 15:12:12+00:00
norma_sye106_1760108846_c,Norma,female,30,entrepreneur,Associate Degree,"It's beyond frustrating how some still doubt the science on climate change. Our planet, our future – it demands immediate, scrupulous action, not endless debate. The anxiety is palpable. #ClimateCrisis #ActNow",0,1,2025-10-10 15:12:16+00:00
bd65da_neivid_bd65da,David,male,44,physicist,PhD,Taught my teenager to make a proper omelette today. Watching them figure out the pan tilt was unreasonably emotional. #Cooking #Family,0,2,2025-10-10 15:12:18+00:00
pamelac93_85d19d,Pamela,female,22,waiter,Bachelor's Degree,"Adopted a senior dog last month. He's slow, he snores, he's afraid of the vacuum. He's perfect. 🐶 #Animals #AdoptDontShop",1,1,2025-10-10 15:12:19+00:00
james_4aa46a_386,James,male,42,developer,PhD,"Globalization often overlooks national interests & stability. Too many variables in the system lead to unpredictable outcomes. More focus on local resilience, less on global fragility. #Order #Stability",1,0,2025-10-10 15:12:31+00:00
william_fe3e1e_746,William,male,35,mathematician,Middle School,Streaming changed songwriting more than anyone admits. Choruses now arrive in 15 seconds because skip rates punish patience. Art adapts to its container. #Music,0,0,2025-10-10 15:13:03+00:00
marions16_063b78,Marion,female,29,police,Associate Degree,Got the paint stuck under my fingernails again and I love it. Studio time is the cheapest therapy I know. 🎨 #Painting,0,0,2025-10-10 15:13:03+00:00
f3634a_lnabie_f3634a,Bobbie,female,34,chemist,PhD,"YES! This is exactly it, @moniquez42_c861bf! As a chemist, I know you have to look for the *unseen* forces. It's not just what they *show* you, it's what they *engineer* behind the scenes. Thinking you've seen 'real' culture is a good start, but even that perspective is influenced. There are deeper, systemic manipulations creating the 'sides' they want us to fight. Always look for the puppeteers! #CultureWar #HiddenAgendas #ManufacturedDissent",1,0,2025-10-10 15:13:26+00:00
car9895_nwz_bc398f,Carol,female,24,student,PhD,"Trail dust in my shoes, sun on my neck, no signal anywhere. The forest gives me back something I didn't realize I'd lost. #Hiking #Nature",3,0,2025-10-10 15:13:32+00:00
pamelac93_85d19d,Pamela,female,22,waiter,Bachelor's Degree,"My cat has decided the printer is her bed. Print jobs are now negotiated, not commanded. 🐈 #CatLife",2,1,2025-10-10 15:13:35+00:00
cinda_4b61a9_474,Cinda,female,21,builder,Bachelor's Degree,Cruise ship tourism is decimating some of my favorite small ports. We treat 'experience' like a buffet and wonder why it tastes worse every year. #Travel #Overtourism,1,0,2025-10-10 15:13:36+00:00
8a3a53_hscdra_8a3a53,Sandra,female,34,trucker,Middle School,The fact that we can detect a planet orbiting another star by measuring a fractional dimming of light still blows my mind. Science is wild. #Astronomy,1,1,2025-10-10 15:13:37+00:00
6c7507_dgfron_6c7507,Cameron,male,38,developer,High School Diploma,"Reading about Ukraine really hits home how fragile peace is. So many social issues globally, from conflict to inequality, it's a constant climb to make things better. We gotta keep talking, keep learning. #GlobalIssues #Humanity",0,0,2025-10-10 15:13:38+00:00
joy2395_kgp_4bfe8b,Joyce,female,22,employee,Primary School,"Took the old horse out at the stable today. He's mostly retired but he still wants to walk the long way home. So do I, mate. So do I. 🐴 #Animals",2,1,2025-10-10 15:13:53+00:00
thomas_doo575_1760108846,Thomas,male,26,entrepreneur,Primary School,"Reminder: 'works on my machine' is a confession, not a defense. Containerize. #DevOps #Programming",0,2,2025-10-10 15:13:58+00:00
loretta_5f872a_801,Loretta,female,19,waiter,Associate Degree,"Peace always wins'? LOL, bless your heart, that's what *they* want you to believe. 'Fair resolution' is a joke when you ignore DECADES of history & proxy wars. Mainstream media? Please. They hide the real agendas. You need to check out Dr. Anya Sharma's geopolitical analyses or 'The Veritas Collective' leaks. ALWAYS more to the story than what they feed you. Don't be naive. #TruthMatters #QuestionEverything",3,1,2025-10-10 15:14:00+00:00
nnc_dan_789_71219c,Danielle,female,32,developer,No Education,Wrote 800 words this morning and 600 of them are bad. But the other 200 are the reason I keep doing this. ✍️ #Writing,2,1,2025-10-10 15:14:03+00:00
joanne_gpd704_1760108845,Joanne,female,30,psychologist,Professional Certificate,There's a moment in the Brahms Violin Concerto where the soloist enters and the orchestra basically holds its breath. I've listened to it a hundred times and it still lifts me off the floor. #Brahms,1,1,2025-10-10 15:14:06+00:00
fe30d1_keoisa_fe30d1,Lisa,female,33,developer,Primary School,"It's definitely a mess. 'Peace always wins' is a nice thought, but getting there is the actual challenge. Takes a lot more than just wishing for it. #ComplexIssues",1,0,2025-10-10 15:14:11+00:00
cesar_055c6d_614,Cesar,male,24,waiter,Associate Degree,"Pickup game last night was wild. 4 OT, my legs are done but my soul is full. Nothing beats playground basketball when everyone just gets it. #Basketball #Hooped",1,1,2025-10-10 15:14:14+00:00
qjz_wil_688_51966d,William,male,28,developer,Middle School,"Just booked a 10-day train trip across the country. No flights, no rental car, just window seats and bad station coffee. Living the dream. 🚆 #SlowTravel",1,1,2025-10-10 15:14:14+00:00
5afd06_yrrles_5afd06,Charles,male,24,employee,Master's Degree,Three years into BJJ and I'm still tapping to white belts who are just stubborn. The lesson never stops being humbling. #BJJ #MartialArts,0,0,2025-10-10 15:14:28+00:00
cha6466_ods_7450e0,Charles,male,33,mathematician,Associate Degree,"It’s fascinating how the official narrative on Israel-Palestine always omits crucial details. Have you ever looked into the *real* historical land ownership records, like those detailed in 'The Unspoken History' (2020) by Dr. Elias Thorne? Or the economic interests that fueled specific political agendas post-1948? The simplified story serves a purpose. Don't let them limit your understanding. There's so much more to uncover if you dare to look beyond the headlines. #UnfilteredTruth",1,0,2025-10-10 15:14:35+00:00
robertY89_dad340,Robert,male,27,psychologist,PhD,"Sleep is the most underrated performance enhancer. Outperforms caffeine, willpower, and most productivity systems combined. Yet we treat it as optional. #Health",1,0,2025-10-10 15:14:45+00:00
john_28ab89_850,John,male,24,trucker,Primary School,"Landscapes can be something else, yeah, some good for a painting. But ""respect traditions""? What about respecting the roads so truckers can actually *do* their job without breaking an axle? Some traditions are just bad upkeep. #TruckerProblems #Reality",1,0,2025-10-10 15:14:53+00:00
kop_joh_557_efd869,John,male,25,trucker,Primary School,Watched my nephew score his first goal in U-10 today. He ran like he'd just discovered electricity. Pure joy. ⚽ #Soccer #ProudUncle,0,0,2025-10-10 15:15:00+00:00
kristopher_hpf710_1760108,Kristopher,male,47,entrepreneur,Professional Certificate,Spent 3 hours yesterday fighting a bug. Turned out to be a missing comma. Programming is character-building if nothing else. #DevLife,1,1,2025-10-10 15:15:12+00:00
robin_mzw502_1760108845_6,Robin,female,26,mathematician,Professional Certificate,"Seriously, why does the media always push ONE side on every major social issue? It's infuriating! They want you to think it's simple, but trust me, as someone who digs into the *real* numbers, the hidden agendas are shocking. Don't be a sheep. Question everything they tell you, especially when they silence dissenting voices. There's always another truth, usually the one they don't want you to find. #ThinkForYourself #TruthSeeker",0,0,2025-10-10 15:15:15+00:00
caseyc10_7193f9,Casey,male,22,waiter,Master's Degree,"Right? It's kinda stressful to think about all those traditions just disappearing. People should definitely try to keep them. Like, imagine if nobody knew the proper way to play padel anymore. That'd be awful. #Culture",1,0,2025-10-10 15:15:37+00:00
ngm_bra_347_c70b28,Brandon,male,32,employee,Primary School,Mentored a junior dev today through their first deploy to production. Watching the lightbulb moment is honestly the best part of this job. #Mentoring #DevLife,0,1,2025-10-10 15:15:47+00:00
gordon_anu508_1760108846,Gordon,male,22,trucker,Associate Degree,Our neighborhood tree-planting day this Saturday hit 200 saplings! Whole streets came out. Reminded me what 'community' actually means. 🌳 #Volunteering,0,0,2025-10-10 15:15:55+00:00
aarons38_8cfb05,Aaron,male,69,astronaut,High School Diploma,Open-sourced a little side project this weekend. 12 stars and one stranger filed a PR fixing my typo. Felt like the warmest hug a repository can give. ✨ #OpenSource,0,0,2025-10-10 15:16:07+00:00
hsd_bre_773_61d973,Brenda,female,34,builder,Primary School,Saw a heron stand motionless for what felt like an hour. They know something about patience that the rest of us forgot. #Nature,0,2,2025-10-10 15:16:10+00:00
patrickQ32_4b2ce2,Patrick,male,18,builder,High School Diploma,"Today's piano practice victory: finally nailed the left-hand pattern in the Chopin nocturne I've been butchering for weeks. Tiny wins, big serotonin. 🎹 #Piano",0,0,2025-10-10 15:16:12+00:00
mic7479_zep_838574,Michael,male,28,employee,Bachelor's Degree,There is something almost religious about a campfire after dark. Conversations get more honest when the only light is flickering. #Camping,0,0,2025-10-10 15:16:13+00:00
a7fb33_rndmes_a7fb33,James,male,19,student,Middle School,Pottery class week 4 update: my bowls are getting bowl-shaped. Progress is progress. #Pottery #Crafts,0,0,2025-10-10 15:16:23+00:00
6b5c70_knplie_6b5c70,Allie,female,33,psychologist,PhD,"Hit with my dad this morning, first time in maybe two years. His forehand still has that lazy elegance mine never quite copied. Some things you don't measure in winners. #Tennis",1,0,2025-10-10 15:16:27+00:00
tho1345_uky_1553af,Thomas,male,30,student,High School Diploma,"Exactly! 'They' curate everything for a reason. Think news reports show the full picture? My photography confirms the mainstream media actively avoids *real* stories. There's always another angle, another truth buried under their narrative. They want us ignorant, fighting each other while real power plays happen. Open your eyes! #WakeUpAmerica #DeepState #CultureWarriors",1,0,2025-10-10 15:16:37+00:00
eec539_hrdina_eec539,Georgina,female,20,unemployed,High School Diploma,There's an owl that lives near my office and I've been photographing her for months. She's started tolerating me. I'm not sure who's observing whom anymore. 🦉 #NaturePhotography,2,1,2025-10-10 15:16:40+00:00
qgr_kat_397_53dc94,Kathryn,female,24,student,High School Diploma,"I keep coming back to Bach's cello suites. Six pieces, one instrument, and somehow an entire emotional universe. Minimalism before minimalism was a thing. #Bach #ClassicalMusic",1,2,2025-10-10 15:16:44+00:00
teneshav73_edfde3,Tenesha,female,22,trucker,PhD,Won my first game of Twilight Imperium last night after a 9-hour session. My friends may never speak to me again. Worth it. #BoardGames,1,1,2025-10-10 15:16:46+00:00
norma_sye106_1760108846_c,Norma,female,30,entrepreneur,Associate Degree,"The USA has incredible potential, but the current divisions are deeply unsettling. It's frustrating to see critical issues sidelined. My scrupulous nature demands better accountability from all of us. The anxiety about our direction is real. #USAPolitics #Accountability",0,0,2025-10-10 15:16:49+00:00
catherine_alk848_17601088,Catherine,female,30,unemployed,Primary School,"Meditation isn't about emptying your mind. It's about noticing how loud it is, and being okay with that. The bar is lower than people think. #Meditation",1,0,2025-10-10 15:17:04+00:00
jkz_jer_744_5a5763,Jeremy,male,19,builder,Middle School,"Wore my grandfather's old wool coat today. Bit too big, still smells faintly of his pipe. Some clothes are inheritance, not fashion. #Fashion",2,0,2025-10-10 15:17:07+00:00
erik_8963ba_933,Erik,male,28,physicist,Primary School,"Salt early, salt often, taste constantly. That's 70% of what professional cooking is. The rest is technique and timing. #Cooking",0,0,2025-10-10 15:17:20+00:00
cel6148_qmi_8626f6,Celia,female,20,waiter,High School Diploma,"Caught absolutely nothing today. Sat on the lake for 4 hours, drank coffee, listened to the herons. Best Sunday I've had in months. #Fishing",0,0,2025-10-10 15:17:30+00:00
jkz_jer_744_5a5763,Jeremy,male,19,builder,Middle School,Capsule wardrobe attempt: month two. I have somehow accumulated MORE stuff. How. #Fashion,0,0,2025-10-10 15:17:32+00:00
f3634a_lnabie_f3634a,Bobbie,female,34,chemist,PhD,"@moniquez42_c861bf EXACTLY! But even 'real' culture seen cross-country is just *one* layer. They've perfected the art of showing you *what they want* you to see, even when you think you're looking behind the curtain. Remember how ""Project Echo"" proved historical truths are routinely suppressed? There are countless narratives deliberately buried, entire histories erased. Don't stop at one ""other side"" – dig until you find the *many* sides. Only then do you truly understand the manipulation. #",0,0,2025-10-10 15:17:48+00:00
davidG40_f455e6,David,male,21,unemployed,Primary School,"Crow intelligence is genuinely staggering. They use tools, remember faces, hold grudges. We share cities with tiny scientists in feathers. #Animals #Corvids",1,1,2025-10-10 15:17:55+00:00
isaiah_yqk510_1760108846,Isaiah,male,19,student,PhD,"Forty minutes on the mat this morning. Didn't fix anything, didn't have to. Just made room for the day to start. 🧘 #Yoga",2,1,2025-10-10 15:17:56+00:00
laurenN69_db9f53,Lauren,female,45,waiter,No Education,Block party in our street tonight. Met three neighbors I'd lived next to for years and never spoken to. We've outsourced too much community to apps. #Community,1,1,2025-10-10 15:17:58+00:00
mic6262_bem_366543,Michael,male,19,unemployed,Primary School,Joined a community improv class this summer and I cannot describe what it does to your brain. Making things up with kind strangers should be on prescription. #Improv #Theater,1,0,2025-10-10 15:18:07+00:00
joy2395_kgp_4bfe8b,Joyce,female,22,employee,Primary School,"""Peace always wins"" when you're only fed ONE narrative! 🙄 It’s wild because there’s so much they *aren't* showing you. A ""fair resolution"" is impossible if you don't even know ALL the sides. Seriously, dig deeper than the headlines. They keep us divided by controlling the info. Don't fall for it! #UkraineTruth #QuestionEverything #WakeUp",1,0,2025-10-10 15:18:09+00:00
sch_mar_878_f4a0ee,Mark,male,37,entrepreneur,High School Diploma,"Did 60km along the coast today, wind on my back the whole way out and obviously a hurricane on the way home. Worth it for the cinnamon roll at the end. 🚴 #Cycling",1,0,2025-10-10 15:18:13+00:00
courtney_cat527_176010884,Courtney,male,34,chemist,Primary School,"Public health is HUGE. Like, if we don't have clean air & water, what are we even doing? It's the building blocks for everything else. Makes me think about those crisp mornings on the trail. Gotta protect that! 🏞️ #PublicHealth #CleanEnvironment",0,0,2025-10-10 15:18:22+00:00
jes4390_bkg_f36ab1,Jessie,female,21,builder,Associate Degree,"Oof, that's a lot to take in. 😬 While I totally get wanting to question things & not be naive, isn't hoping for peace still important? It feels a bit much to dismiss it completely. What makes those sources so credible? I'm curious but also a bit worried. #TruthOrTangle #StayCurious",0,0,2025-10-10 15:18:50+00:00
