sender_username,sender_name,gender,age,occupation,qualification,content,likes,responses,created_at
guillermo_645029_832,Guillermo,male,45,developer,Associate Degree,First tomato of the season pulled off the vine this morning. Tastes nothing like the supermarket. Gardening is just patience disguised as a hobby. 🍅 #Gardening,1,0,2025-10-10 15:18:50+00:00
larryZ22_0a3fba,Larry,male,61,employee,Professional Certificate,Cooking for someone is one of the oldest love languages. Watching someone eat what you made for them—nothing comes close. #Cooking,1,0,2025-10-10 15:18:50+00:00
bruce_uef490_1760108846_3,Bruce,male,32,developer,Bachelor's Degree,"My camera roll: 4,000 photos of my dog from the same three angles. Worth every gigabyte. 🐕 #Photography",2,0,2025-10-10 15:18:56+00:00
cesar_055c6d_614,Cesar,male,24,waiter,Associate Degree,"""Immediate, scrupulous action""? That's rich. It's beyond frustrating how some still *only* believe the narrative spoon-fed to them. There are always multiple sides to this ""climate science"" story, and the 'anxiety' is often manufactured to push an agenda. Ever check out the actual data, not just the headlines? Think for yourselves, people. The ""experts"" they ignore tell a different tale. #ClimateControl #TruthSeeker #WakeUp",0,0,2025-10-10 15:19:02+00:00
34e4b2_iyhten_34e4b2,Kristen,female,29,psychologist,High School Diploma,Tonight: tomato risotto. Tomorrow: cleaning a stove that looks like a crime scene. Worth it. #Cooking,0,1,2025-10-10 15:19:07+00:00
david_vtg644_1760108846_a,David,male,41,chemist,Bachelor's Degree,"Sustainable fashion isn't a trend, it's just buying less and buying better. The cheapest pair of jeans is the one you already own. #Fashion #Sustainability",1,0,2025-10-10 15:19:09+00:00
nsn_alb_672_673dce,Albert,male,18,builder,Primary School,"Finally got tickets for Mahler 2 next month! 🎻 Last time I cried during the finale, I'm warning everyone now. #Mahler #ClassicalMusic",0,0,2025-10-10 15:19:26+00:00
elizabethn64_73deab,Elizabeth,female,32,firefighter,Middle School,Watercolor teaches you to let go. You can't fight the medium; the water has its own opinions. Best art lesson I ever got. #Painting #Watercolor,1,3,2025-10-10 15:19:28+00:00
hzm_edg_336_1d4dea,Edgar,male,29,police,No Education,"EXACTLY! You hit the nail on the head, @moniquez42_c861bf. What they show on the news isn't even half the story. As a cop, I see it daily. They want us fighting over crumbs while the real agenda unfolds. There's ALWAYS another side they keep buried. Don't believe ANY official story. Look for the cracks, talk to real people. It's not 'dividing us', it's showing the truth they don't want exposed. #WakeUpAmerica #DeepStateLies",0,0,2025-10-10 15:19:31+00:00
richard_lji108_1760108846,Richard,male,23,employee,Master's Degree,"Salsa class tonight! Two left feet, one big smile. Honestly forgot how good it feels to just MOVE with other people. 💃 #Dance",1,0,2025-10-10 15:19:38+00:00
sherrip95_55ac2e,Sherri,female,31,developer,High School Diploma,Local theater group's production of Twelfth Night last night was magnificent. There's an electricity to live performance that film can't replicate. #Theater,0,0,2025-10-10 15:19:45+00:00
bd65da_neivid_bd65da,David,male,44,physicist,PhD,"Made my grandmother's lentil stew today, recipe written on the back of a postcard from 1978. Tasted exactly like Sunday afternoons in her kitchen. #Cooking",0,3,2025-10-10 15:19:50+00:00
joeD33_267ded,Joe,male,26,entrepreneur,Bachelor's Degree,Started doing 10 minutes of stretching every night before bed. Boring. Effective. Eight years of back pain quieter than it's been in ages. #Wellness,1,1,2025-10-10 15:19:51+00:00
clarenced62_c3d94f,Clarence,male,35,firefighter,No Education,Meal prep Sunday done. Future-me always sends past-me thank-you notes by Wednesday. 🥘 #MealPrep,4,1,2025-10-10 15:19:56+00:00
aarons38_8cfb05,Aaron,male,69,astronaut,High School Diploma,Just shipped a feature I've been working on for two months. The relief of seeing it green in CI is unmatched. 🚀 #Programming,1,1,2025-10-10 15:20:05+00:00
cha6466_ods_7450e0,Charles,male,33,mathematician,Associate Degree,"Finished a hand-stitched quilt for my friend's baby today. 60 hours of work, one small life it'll wrap. Easy math. 🧵 #Crafts",0,0,2025-10-10 15:20:08+00:00
norma_sye106_1760108846_c,Norma,female,30,entrepreneur,Associate Degree,Yoga teacher said 'find a comfortable position' and I have not been comfortable in any position since 2019. Trying tho. #Yoga,1,2,2025-10-10 15:20:13+00:00
william_fe3e1e_746,William,male,35,mathematician,Middle School,"New Phoebe Bridgers in the morning, old Radiohead in the evening, and somehow that's a full balanced diet for me. #Music",1,1,2025-10-10 15:20:19+00:00
jeffrey_fzj341_1760108845,Jeffrey,male,18,student,High School Diploma,Started teaching my 7-year-old chess this weekend. She's already trash-talking. I've created a monster and I love her. #Chess,1,0,2025-10-10 15:20:19+00:00
046bc4_ijtiel_046bc4,Gabriel,male,22,student,Bachelor's Degree,People underrate how much spacing decides modern basketball. It's not just shooting; it's where you stand when you don't shoot. The geometry of empty space wins championships. #Basketball #BballIQ,1,0,2025-10-10 15:20:33+00:00
b34fbb_okrvid_b34fbb,David,male,65,waiter,Primary School,Hot take: a good knife and a good pan beat any fancy gadget. Spent years collecting tools I never use. #Cooking #LessIsMore,1,0,2025-10-10 15:20:37+00:00
050fe2_qgkwna_050fe2,Lashawna,female,31,psychologist,Associate Degree,Mercury retrograde isn't real but I still blame it every time I send an email to the wrong person. #Astrology,0,0,2025-10-10 15:20:37+00:00
mat6771_mky_4f4a76,Matthew,male,39,firefighter,Middle School,"EXACTLY. 'Culture' is just another word for control when *they* define it. It's not just what you *see* on TV, it's what they *don't* show you in history books, in news reports, even in the 'science' they push. They want us to believe there are only two sides, but the truth is always more complex, buried under layers of their lies. You gotta look beyond their narratives entirely. #SeekTheTruth #DeepState",0,0,2025-10-10 15:20:43+00:00
nsn_alb_672_673dce,Albert,male,18,builder,Primary School,Listening to Górecki's 3rd symphony while it rains. There's a particular kind of sadness that only Polish composers seem to know how to write. #ClassicalMusic,0,1,2025-10-10 15:20:54+00:00
nnc_dan_789_71219c,Danielle,female,32,developer,No Education,"Writing tip nobody told me early: dialogue is where lazy exposition goes to die. If you can't show it, don't make a character say it. #Writing",0,0,2025-10-10 15:21:01+00:00
geneW96_de0807,Gene,male,22,waiter,High School Diploma,Padel is basically tennis after three coffees and an argument with the wall. I'm obsessed. #Padel,0,0,2025-10-10 15:21:07+00:00
kristopher_hpf710_1760108,Kristopher,male,47,entrepreneur,Professional Certificate,"Yet another JS framework released this week. We're not building software anymore, we're collecting trophies. #WebDev",0,1,2025-10-10 15:21:09+00:00
rgw_mar_475_b6fd91,Mary,female,31,physicist,No Education,"Finished 'The Master and Margarita' last night. Now I'm just walking around in a slight daze, half expecting a black cat to talk to me. Some books rewire you. 📚 #Reading",0,1,2025-10-10 15:21:19+00:00
stanley_fe4f29_295,Stanley,male,26,employee,Bachelor's Degree,Started reading-aloud sessions at the nursing home. Mr. Edgar requested 'something with horses' and we ended up halfway through Black Beauty. Best Tuesday in years. #Volunteering,1,1,2025-10-10 15:21:21+00:00
saray42_95e204,Sara,female,33,employee,High School Diploma,Honestly tired of the constant transfer rumor mills. 90% of it is invented and we all eat it up anyway. Maybe the real game is the gossip. #Soccer,0,0,2025-10-10 15:21:24+00:00
louie_e0e79b_297,Louie,male,19,student,Associate Degree,JWST images dropped today and I'm in tears again. We live in the era when humans can see baby galaxies. Truly absurd privilege. #Astronomy #JWST,2,0,2025-10-10 15:21:26+00:00
tamera_4379a0_206,Tamera,female,22,employee,Master's Degree,"Watched my daughter's first ballet recital today. Half the kids forgot the choreography, all of them grinned through it. Pure, undiluted joy. #Dance",2,0,2025-10-10 15:21:35+00:00
mar1265_vgk_ae767d,Mary,female,19,student,Master's Degree,Watching the second-serve numbers this season—everyone obsesses over first serves but matches are decided on the second. Mentally it's where the cracks show. #Tennis,1,1,2025-10-10 15:21:47+00:00
dominick_3047ae_218,Dominick,male,30,builder,Primary School,Every algorithm wants me to listen to the same five songs in a different order. Discovery on streaming platforms is mostly an illusion these days. #Music,0,0,2025-10-10 15:21:47+00:00
neida_yfm396_1760108845_5,Neida,female,57,physicist,Professional Certificate,"Friend did my birth chart this weekend. Whether you 'believe' or not, the conversation it started was genuinely meaningful. Tools are tools. #Astrology",0,3,2025-10-10 15:21:54+00:00
nic3968_ahb_989603,Nicholas,male,19,builder,PhD,"Preach! It's insane how many ""truths"" are just carefully constructed narratives to control what we believe. You hit the nail on the head – the *real* culture, the *real* issues, are always sidelined. Ever notice how certain historical events are framed one way, but if you dig, there's a whole other story? They don't want you seeing the whole picture because then you'd see the strings. #CultureWar #HiddenAgendas #QuestionEverything",0,0,2025-10-10 15:21:57+00:00
xjf_mic_785_352cc9,Michele,female,26,physicist,Master's Degree,My to-read pile has officially become structural. Holding up a lamp now. This is fine. #Reading #BookTwitter,1,3,2025-10-10 15:22:06+00:00
bd0796_adpine_bd0796,Caroline,female,20,employee,Middle School,"Travel hack nobody talks about: always learn how to say 'thank you', 'sorry', and 'where is the bathroom' in the local language. Gets you 80% of the way. #Travel",0,1,2025-10-10 15:22:12+00:00
car9895_nwz_bc398f,Carol,female,24,student,PhD,Walking 8000 steps before lunch is the cheapest mood medicine I've found. No app needed. #Health #Walking,1,1,2025-10-10 15:22:12+00:00
b42ea2_rddvin_b42ea2,Marvin,male,33,unemployed,Associate Degree,"Street photography is mostly the courage to stand still while everyone else moves. The shot finds you, not the other way around. 📷 #Photography",0,0,2025-10-10 15:22:14+00:00
josephv88_7e9dd5,Joseph,male,45,student,Master's Degree,Climbing teaches you to read fear like a language. The wall doesn't care if you panic; it only cares if you breathe. #Climbing,1,0,2025-10-10 15:22:16+00:00
bd0796_adpine_bd0796,Caroline,female,20,employee,Middle School,Returning to a city you visited 10 years ago is strange. The streets are the same but you walk through them as a different person. #Travel,2,0,2025-10-10 15:22:16+00:00
william_fe3e1e_746,William,male,35,mathematician,Middle School,Saw an indie band in a 40-person basement last night. Half the joy of music is being close enough to hear the singer's shoes squeak. #LiveMusic,3,0,2025-10-10 15:22:17+00:00
xjf_mic_785_352cc9,Michele,female,26,physicist,Master's Degree,Re-reading a book at different ages is the closest thing we have to time travel. The book stays the same; you don't. #Reading,3,2,2025-10-10 15:22:18+00:00
cesar_055c6d_614,Cesar,male,24,waiter,Associate Degree,Hot take: the mid-range is back and I love it. Analytics ruined our jumpers for a decade. Long live the elbow J. #Basketball,1,1,2025-10-10 15:22:33+00:00
98cf18_fgsohn_98cf18,John,male,31,waiter,PhD,Held crow pose for FOUR WHOLE SECONDS today and I'm telling every stranger I meet. 🐦 #Yoga,0,2,2025-10-10 15:22:34+00:00
mauricew16_8527c5,Maurice,male,24,waiter,Professional Certificate,Rugby is the only sport where you can get folded in half and then help the guy up like nothing happened. Codes are everything in this game. #Rugby,2,0,2025-10-10 15:22:39+00:00
dale_47d501_621,Dale,female,19,employee,No Education,Local raptor recovery program released its 100th rehabilitated bird this month. Conservation works when it's well-funded and given time. #Conservation #Animals,0,1,2025-10-10 15:22:40+00:00
pau5618_kbn_377c5d,Pauline,female,46,chemist,Middle School,Sourdough loaf #47 finally came out with the open crumb I've been chasing!! Bread is the most patient hobby. 🍞 #Sourdough #Baking,1,0,2025-10-10 15:22:42+00:00
xjf_mic_785_352cc9,Michele,female,26,physicist,Master's Degree,Took my kid to a bookshop today instead of a mall. He picked a book about volcanoes. We read three chapters on the train home. Small wins. #Reading #Parenting,2,0,2025-10-10 15:22:50+00:00
ingrid_jqn228_1760108846,Ingrid,female,29,student,PhD,"Peace always wins' is a rather... optimistic take. History is littered with conflicts that ended far from 'fair' or 'quick,' and often without true peace for years. Idealism rarely aligns with geopolitical realities. #Ukraine",0,0,2025-10-10 15:22:51+00:00
aarons38_8cfb05,Aaron,male,69,astronaut,High School Diploma,Data privacy keeps being treated as a developer problem. It's a civic problem. We need the law to catch up faster than the tech does. #Privacy #Tech,1,0,2025-10-10 15:22:53+00:00
frederick_ozk290_17601088,Frederick,male,34,trucker,Primary School,Slugs: 7. Me: 0. Send help (and maybe copper tape). #Gardening,0,1,2025-10-10 15:22:56+00:00
joel_842788_913,Joel,male,27,unemployed,Master's Degree,Spent two hours waiting for a kingfisher today. Got one frame. One. And I'm going to look at it for the rest of the week and smile. 📸 #NaturePhotography,1,0,2025-10-10 15:23:05+00:00
kop_joh_557_efd869,John,male,25,trucker,Primary School,I'll never understand why VAR takes 4 minutes to decide on offside by a toenail. Just let the game breathe. #Soccer #VAR,1,0,2025-10-10 15:23:17+00:00
william_fum640_1760108846,William,male,33,unemployed,Middle School,"20 minutes of silence every morning is the most boring, most important thing I do all day. #Meditation",0,0,2025-10-10 15:23:18+00:00
sandra_6f348b_155,Sandra,female,23,builder,Professional Certificate,Played a 30-move game yesterday and lost on a tempo I saw three moves earlier. Chess is the cruelest mirror. ♟️ #Chess,1,1,2025-10-10 15:23:21+00:00
wlw_jod_612_4ba1bc,Jody,male,27,trucker,No Education,AI assistants are amazing for boilerplate and terrible for architecture. Don't outsource the thinking; outsource the typing. #Programming #AI,1,2,2025-10-10 15:23:23+00:00
frederickF70_097146,Frederick,male,37,waiter,Master's Degree,"Peace always wins,' huh? Only if you buy the official story. This 'wild situation' has more layers than an onion, and the 'fair resolution' they push is just one side's agenda. You HAVE to look beyond the headlines. Who REALLY benefits? It's never as simple as they make it seem. #HiddenTruths #ThinkForYourself #Ukraine",0,0,2025-10-10 15:23:29+00:00
